datetime,title,crime_type,address,zip
2015-11-06T06:00:00-05:00,Police: Sunrise predator going after women near the Savin Hill T stop,Indecent assault and battery,130 Auckland St.,02125
2015-11-05T19:00:00-05:00,Person stabbed in lower Roxbury,Stabbing,60 Camden St.,02118
2015-11-05T16:30:00-05:00,Shots fired off Melnea Cass Boulevard,Gunfire,73 Windsor St.,02120
2015-11-04T15:30:00-05:00,South End crash sends two elderly pedestrians to the hospital in bad shape,Crash,Tremont St. and W. Brookline St.,02118
2015-11-03T00:15:00-05:00,Man shot to death in Dorchester,Murder,15 Shepton St.,02124
2015-11-02T14:50:00-05:00,"Criminal pro tip: If you&#039;ve nicked yourself shaving, you might want to put off that bank robbery you&#039;d been planning",Bank robbery,441 W. Broadway,02127
2015-11-02T03:15:00-05:00,Police: Teen with loaded gun gets into argument with man in Fields Corner; officers intervene before he can use it,Illegal gun possession,Dorchester Ave. and Faulkner St.,02122
2015-11-01T17:40:00-05:00,Shots fired near Edward Everett Square,Gunfire,14 Elder St.,02125
2015-11-01T16:30:00-05:00,Person shot near Franklin Field,Shooting,20 Stratton St.,02124
2015-10-31T20:00:00-04:00,Alleged gun-packing gangbanger unable to outrun fleet-footed lawman in the South End,Illegal gun possession,Tremont St. and Aguadilla St.,02118
2015-10-30T18:35:00-04:00,East Boston bank held up,Bank robbery,1 Bennington St.,02128
2015-10-29T01:00:00-04:00,Man stabbed in the neck outside the Point bar,Stabbing,Marshall St. and Hanover St.,02108
2015-10-28T15:10:00-04:00,Man shot at Whittier Street apartments in incident that started at Ruggles T stop,Shooting,Tremont St. and Ruggles St.,02120
2015-10-26T22:00:00-04:00,Two tossed in lockup on charges they robbed a man of his salad at gunpoint outside Savin Hill T stop,Armed robbery,121 Savin Hill Ave.,02125
2015-10-25T02:21:00-04:00,Woman slashed in fight with knife-wielding purse snatcher in Fenway,Assault and battery with a dangerous weapon,137 Park Dr.,02215
2015-10-24T12:40:00-04:00,Police: Woman fatally shoots relative in the head in Hyde Park,Murder,239 Wood Ave.,02136
2015-10-23T12:01:00-04:00,Hoodie-wearing robber strikes another Boston bank,Bank robbery,780 Gallivan Blvd.,02122
2015-10-22T21:15:00-04:00,Three stabbed in Dorchester,Stabbing,95 Bloomfield St.,02124
2015-10-22T15:30:00-04:00,Person stabbed outside Jackson Square T stop,Murder,Centre St. and Lamartine St.,02130
2015-10-22T11:55:00-04:00,Man shot to death in Brighton,Murder,124 Telford St. Extension,02135
2015-10-22T10:40:00-04:00,Police: Teen tried to sneak loaded gun into Dorchester school,Illegal weapons possession,9 Peacevale Rd.,02124
2015-10-19T23:55:00-04:00,Three Lawrence men charged with two armed robberies in the North End,Armed robbery,North St. and Cross St.,02109
2015-10-18T02:00:00-04:00,BU student sexually assaulted in her dorm room,Sexual attack,33 Harry Agganis Way,02215
2015-10-17T22:45:00-04:00,Food-delivery guy robbed at gunpoint in Mattapan,Armed robbery,Orchard St. and Vanderbilt St.,02126
2015-10-17T13:00:00-04:00,Guy in hoodie sought for East Boston bank robbery,Bank robbery,246 Border St.,02128
2015-10-17T12:51:00-04:00,SWAT team helps arrest Hyde Park man in JP on charges he fired gun in Roxbury,Gunfire,208 Hampden St.,02119
2015-10-16T22:20:00-04:00,Car shot up in South Boston,Gunfire,19 Gavin Way,02127
2015-10-16T20:10:00-04:00,"Police: When confronted by officers pointing real guns at him, man refused to drop the fake gun he&#039;d been waving in an argument",Assault with a dangerous weapon,Roxbury St. and Malcolm X Blvd.,02119
2015-10-16T09:00:00-04:00,Back Bay market robbed this morning,Unarmed robbery,21 Massachusetts Ave.,02115
2015-10-16T07:55:00-04:00,"Argument leads to gunfire outside Forest Hills station; Orange Line service, roads were shut",Gunfire,Asticou Rd. and Washington St.,02130
2015-10-15T23:15:00-04:00,Person shot in the back on Shawmut Avenue,Shooting,617 Shawmut Ave.,02118
2015-10-15T22:10:00-04:00,Gunfire a couple blocks from B3 police station,Gunfire,12 Havelock St.,02124
2015-10-14T02:20:00-04:00,"Man shot at on Washington Street at West Roxbury/Roslindale line, suffers only finger injury",Shooting,4740 Washington St.,02132
2015-10-13T22:00:00-04:00,Person stabbed in Ashmont station,Stabbing,1900 Dorchester Ave.,02124
2015-10-09T22:00:00-04:00,Car shot up in Codman Square,Gunfire,37 W. Tremlett St.,02124
2015-10-09T15:05:00-04:00,Beacon Hill bank held up at gunpoint; two arrested while trying to make their getaway in a taxi,Bank robbery,80 Charles St.,02114
2015-10-08T23:00:00-04:00,Man charged with trying to set two sleeping homeless men on fire in Downtown Crossing,Attempted murder,41 West St.,02111
2015-10-08T15:30:00-04:00,Man stabbed repeatedly at Park and Tremont,Stabbing,Park St. and Tremont St.,02108
2015-10-07T21:30:00-04:00,Three stabbed in argument over dog at West Roxbury market,Stabbing,243 Grove St.,02132
2015-10-06T16:35:00-04:00,Gunfire at Humboldt Avenue and Hutchings Street in Roxbury,Gunfire,76 Hutchings St.,02121
2015-10-05T02:40:00-04:00,Man stabbed in chest in Dorchester robbery,Stabbing,Harvard St. and  Paxton St.,02124
2015-10-04T21:00:00-04:00,Man charged with beating pal nearly to death at Back Bay station; victim lay there for several hours,Assault and battery with a dangerous weapon,145 Dartmouth St.,02116
2015-10-04T04:12:00-04:00,Man shot at Bromley-Heath,Shooting,900 Parker St.,02130
2015-10-03T23:25:00-04:00,Man sliced in attack in East Boston market,Stabbing,140 Princeton St.,02128
2015-10-02T20:30:00-04:00,Northeastern student robbed at gunpoint,Armed robbery,96 Fenway,02115
2015-10-02T18:10:00-04:00,Man shot in the back at Franklin Field,Shooting,5 Ames Way,02124
2015-09-30T22:10:00-04:00,Man shot in East Boston,Shooting,130 Sumner St.,02128
2015-09-30T14:10:00-04:00,South End bank held up by two guys with a gun,Bank robbery,540 Tremont St.,02116
2015-09-30T04:05:00-04:00,Man shot to death in Hyde Park,Murder,493 Huntington Ave.,02115
2015-09-30T01:15:00-04:00,"Police know that two men wound up stabbed in Egleston Square early one September morning, but not much else",Stabbing,3171 Washington St.,02130
2015-09-29T00:45:00-04:00,Police: Allston highwayman slices and gnaws victim; apologizes when caught,Armed robbery,Ashford St. and Chester St.,02134
2015-09-28T20:35:00-04:00,Man shot in Roxbury,Shooting,26 Albion St.,02119
2015-09-28T15:00:00-04:00,Man sought for bank robbery near South Station,Bank robbery,One Financial Center,02110
2015-09-28T12:30:00-04:00,"DA: Dorchester teen charged with gun possession has bail reduced, gets out, promptly gets arrested on new gun charge",Illegal gun possession,8 Rozella St.,02122
2015-09-28T04:55:00-04:00,Early morning shooting on Columbia Road sends one to the hospital,Shooting,450 Columbia Rd.,02125
2015-09-27T23:00:00-04:00,"Woman robbed, raped at knifepoint in Dorchester",Rape,Dorchester Ave. and Harbor View St.,02125
2015-09-27T22:00:00-04:00,"Man caught on video in Fields Corner armed robbery may be responsible for rape on Dot. Ave. the same night, police say",Armed robbery,Ditson St. and Leroy St.,02122
2015-09-27T20:20:00-04:00,Police: Brighton carjacking suspect attacks cop who refused his demand to shoot him,Assault and battery,66 Union St.,02135
2015-09-27T02:23:00-04:00,Two restaurants and a pool hall in East Boston get a week to show what they&#039;re doing about all the stabbings outside their doors,Stabbing,19 Bennington St.,02128
2015-09-25T22:10:00-04:00,Shots fired in South Boston,Gunfire,64 Dalessio Ct.,02127
2015-09-24T14:00:00-04:00,Multiple shots fired on Blue Hill Avenue in Roxbury,Gunfire,Blue Hill Ave. and Gaston St.,02121
2015-09-23T20:40:00-04:00,Man shot to death on Intervale Street,Murder,96 Intervale St.,02121
2015-09-22T21:50:00-04:00,Bullets fly at Roxbury intersection,Gunfire,79 Dale St.,02119
2015-09-22T16:40:00-04:00,Somebody shot on Huntington Avenue in the Fenway,Shooting,319 Huntington Ave.,02115
2015-09-21T20:25:00-04:00,Shots fired in South Boston,Gunfire,W 7 St. and C St.,02127
2015-09-21T16:20:00-04:00,Police hunt man they say threatened bus driver with a screwdriver,Assault with a dangerous weapon,Blue Hill Ave. and Pasadena Rd.,02121
2015-09-20T17:15:00-04:00,Man stabbed to death in East Boston,Murder,72 Trenton St.,02128
2015-09-20T06:00:00-04:00,Gunfire behind Chinatown building,Gunfire,39 Boylston St.,02116
2015-09-20T01:40:00-04:00,Police: Man&#039;s gun goes off as he&#039;s pistol-whipping woman after Roxbury car crash; bullets don&#039;t hit her,Assault and battery with a dangerous weapon,21 Dudley St.,02119
2015-09-19T11:20:00-04:00,Gunfire erupts near scene of double murder in Egleston Square,Gunfire,Ernst St. and Bragdon St.,02119
2015-09-18T19:38:00-04:00,Shots fired on Centre Street in Jamaica Plain,Gunfire,340 Centre St.,02130
2015-09-18T12:30:00-04:00,Police: East Boston man arrested with armory that included two IEDs,Illegal gun possession,36 Eutaw St.,02128
2015-09-16T12:15:00-04:00,Man shot to death in Mission Hill parking lot near Brigham Circle,Murder,Calumet St. and Huntington Ave.,02120
2015-09-16T01:17:00-04:00,Another woman attacked at intersection near Edward Everett Square,Indecent assault and battery,Boston St. and Mayhew St.,02125
2015-09-15T00:30:00-04:00,"Police say woman forced into her Fenway apartment, attacked",Sexual attack,Queensberry St.,02215
2015-09-14T15:10:00-04:00,Roxbury intersection hit with barrage of gunfire,Gunfire,298 Dudley St.,02119
2015-09-12T22:27:00-04:00,Man shot in Roslindale,Shooting,14 Kittredge St.,02131
2015-09-11T08:45:00-04:00,Police investigate armed home invasion in Jamaica Plain,Armed home invasion,24 Walk Hill St.,02130
2015-09-10T04:40:00-04:00,Man shot to death in Roxbury,Murder,56 Holworthy St.,02121
2015-09-09T21:45:00-04:00,Two arrested for string of armed robberies from Mattapan to Brookline,Armed robbery,547 Washington St.,02111
2015-09-08T10:20:00-04:00,Jamaica Plain bank held up,Bank robbery,687 Centre St.,02130
2015-09-07T08:00:00-04:00,Man found stabbed to death on Constitution Beach,Murder,1 Rice St.,02128
2015-09-06T22:25:00-04:00,Three armed robberies in Fields Corner today may be linked,Armed robbery,1580 Dorchester Ave.,02122
2015-09-06T01:55:00-04:00,Two shot in hail of gunfire outside Fenway Park overnight,Shooting,Brookline Avenue and Yawkey Way,02215
2015-09-06T01:14:00-04:00,Man shot repeatedly in Roxbury; suspect arrested,Shooting,Dudley St. and Clarence St.,02119
2015-09-05T03:00:00-04:00,"Groper on the loose in Dorchester, South Boston",Indecent assault and battery,Boston St. and Mayhew St.,02125
2015-09-04T02:00:00-04:00,"Knife-wielding, out-of-shape purse snatcher nabbed in Allston",Armed Robbery,6 Radcliff Rd.,02134
2015-09-03T22:45:00-04:00,Dorchester street sprayed with gunfire,Gunfire,103 Intervale St.,02121
2015-09-03T14:15:00-04:00,Shots fired in Uphams Corner,Gunfire,600 Dudley St.,02125
2015-09-03T11:10:00-04:00,"One stabbed, one sliced on Mason Street downtown",Stabbing,Mason St. and Avery St.,02111
2015-09-02T23:50:00-04:00,Woman robbed at gunpoint at Mattapan/Milton line,Armed robbery,82 River St.,02126
2015-09-02T23:15:00-04:00,"Guy fires gun repeatedly at somebody on Heath Street, misses",Gunfire,154 Heath St.,02130
2015-08-31T23:40:00-04:00,Armed robbery in Brighton,Armed robbery,15 Lothian Rd.,02135
2015-08-30T20:10:00-04:00,Gunfire outside Dorchester park,Gunfire,39 Belden St.,02125
2015-08-30T03:00:00-04:00,Police investigate two sexual attacks in Allston,Indecent assault and battery,Brighton Ave. and Park Vale Ave.,02134
2015-08-29T04:15:00-04:00,"Judge orders curfew, GPS for Roslindale woman on gun charges after questioning what she was doing in Franklin Field",Illegal gun possession,70 Ames St.,02124
2015-08-29T02:40:00-04:00,"Three shot, one dead on Creston Street, Dorchester",Murder,29 Creston St.,02121
2015-08-29T01:45:00-04:00,Man shot in the face in Mattapan,Shooting,Blue Hill Ave. and Woodhaven St.,02126
2015-08-25T17:55:00-04:00,Houses strafed in Mattapan,Gunfire,Evelyn St. and Norfolk St.,02126
2015-08-24T21:55:00-04:00,Man shot in the arm in Dorchester,Shooting,Hamilton St. and Stonehurst St.,02122
2015-08-23T23:40:00-04:00,Man roughed up by guys with machetes in East Boston,Assault and battery with a dangerous weapon,144 Chelsea St.,02128
2015-08-23T23:40:00-04:00,Shots fired in Dorchester,Gunfire,53 Stockton St.,02124
2015-08-21T23:20:00-04:00,Two Blue Hill Avenue convenience stores robbed at gunpoint in 24 hours,Armed robbery,646 Blue Hill Ave.,02121
2015-08-21T09:40:00-04:00,Man hunted for St. Botolph Street carjacking and car fire,Carjacking,St. Botolph St. and Cumberland St.,02115
2015-08-19T11:25:00-04:00,Man in car shot in West Roxbury,Shooting,Spring St. and Baker St.,02132
2015-08-19T00:30:00-04:00,"South Boston brothers charged with beating, urinating on homeless man outside JFK T stop",Assault and battery with a dangerous weapon,JFK/UMass Station,02125
2015-08-18T23:10:00-04:00,"House, car shot up in Roxbury",Gunfire,67 St. Richard St.,02119
2015-08-17T23:59:00-04:00,Gunfire erupts in Uphams Corner,Gunfire,Groom St. and Humphreys St.,02125
2015-08-17T14:20:00-04:00,"Gunman opens fire outside Roxbury pool; building, but no people, hit",Gunfire,120 Martin Luther King Blvd.,02119
2015-08-16T20:30:00-04:00,"Shoeless, shirtless man with dog, two pals sought for attack outside Sullivan Square T stop",Assault and battery,1 Cambridge St.,02114
2015-08-15T23:00:00-04:00,Alleged drug dealer charged with hitting three cops with her car in escape attempt,Assault and battery with a dangerous weapon,Walnut Ave. and Humboldt Ave.,02119
2015-08-15T03:26:00-04:00,"Bullets, bowling balls flew when gang beef flared at Dorchester lanes",Assault and battery,820 Morrissey Blvd.,02122
2015-08-15T00:35:00-04:00,Person stabbed in Allston,Stabbing,30 Holton St.,02134
2015-08-15T00:30:00-04:00,Two shot at Bromley-Heath,Shooting,26 Walden St.,02130
2015-08-14T21:45:00-04:00,Gunfire in Dorchester leaves one with a graze wound,Shooting,Olney St. and Everton St.,02121
2015-08-14T21:15:00-04:00,Gunfire in front of Boston Police headquarters,Gunfire,Tremont St. and Whittier St.,02120
2015-08-13T23:45:00-04:00,Two shot in Dorchester parking lot,Shooting,Hancock St. and Trull St.,02125
2015-08-13T16:35:00-04:00,Man shot in Dorchester,Shooting,43 Norton St.,02125
2015-08-12T22:15:00-04:00,"Three shot, two dead in Egleston Square",Murder,Ernst St. and Bragdon St.,02119
2015-08-12T22:15:00-04:00,"Three shot in Mattapan, one dead",Murder,41 Hosmer St.,02126
2015-08-10T23:55:00-04:00,Woman robbed at gunpoint near mayor&#039;s old house,Armed robbery,Savin Hill Ave. and Tuttle St.,02125
2015-08-10T14:15:00-04:00,Man stabbed in South End building,Stabbing,143 W. Brookline St.,02118
2015-08-08T16:40:00-04:00,"Police: Man faces gun, drug charges after driving by a traffic cop while smoking pot",Illegal gun possession,Dudley St. and Howard St.,02125
2015-08-08T02:15:00-04:00,Man shot in the head in Roxbury,Shooting,40 Annunciation Rd.,02120
2015-08-08T00:40:00-04:00,Grazed by bullet in Dudley Square,Shooting,Ziegler St. and Bethune Way,02119
2015-08-07T23:45:00-04:00,Gunfire erupts at three locations in Dorchester and Mattapan around same time; one victim shows up at the hospital,Shooting,Blue Hill Ave. and Clarkwood St.,02126
2015-08-07T07:30:00-04:00,Bicyclist killed by semi in Back Bay hit and run,Hit and run,Massachusetts Ave. and Beacon St.,02115
2015-08-07T02:48:00-04:00,"Cabbie tased, carjacked on Expressway; suspects crash cab in Mattapan",Carjacking,I-93,
2015-08-06T15:00:00-04:00,Man robbed at gunpoint and machetepoint in Jamaica Plain,Armed robbery,Chestnut Ave. and Centre St.,02130
2015-08-05T13:30:00-04:00,Man stabbed in Mattapan apartment,Stabbing,3 Mulvey St.,02126
2015-08-05T12:00:00-04:00,Allston corner freed from threat of taser fiend,Assault with a dangerous weapon,1229 Commonwealth Ave.,02134
2015-08-03T12:45:00-04:00,Three shot in Roxbury,Shooting,92 Academy Terrace,02119
2015-08-02T23:55:00-04:00,Man shot in Jamaica Plain,Shooting,21 Round Hill St.,02130
2015-08-01T18:00:00-04:00,Shooting in Roxbury,Shooting,Waumbeck St. and Harold St.,02121
2015-07-30T21:00:00-04:00,"Three robbed by men with a shotgun in Dorchester, Mattapan",Armed robbery,Mariposa St. and Sefton St.,02126
2015-07-30T21:00:00-04:00,"Three robbed by men with a shotgun in Dorchester, Mattapan",Armed robbery,911 Blue Hill Ave.,02124
2015-07-30T15:00:00-04:00,Man stabbed in South Boston,Stabbing,Patterson Way,02127
2015-07-29T23:30:00-04:00,Police: Gun suspect on bike tries to escape; pedals into back of a cruiser,Illegal gun possession,Parker St. and Annunciation Rd.,02120
2015-07-29T21:18:00-04:00,Two shot in Roxbury,Shooting,Townsend St. and Humboldt Ave.,02121
2015-07-29T19:10:00-04:00,Man stabbed with broken bottle in fight,Stabbing,Harvard St. and Franklin Hill Ave.,02124
2015-07-28T22:30:00-04:00,Woman shot in the chest at Normandy and Seaver,Murder,339 Seaver St.,02121
2015-07-27T17:00:00-04:00,Police hunt three for home invasion near Cleveland Circle,Home invasion,83 Englewood Ave.,02135
2015-07-27T08:30:00-04:00,Woman sexually attacked on East Boston Greenway,Sexual attack,Bremen St. and Sumner St.,02128
2015-07-27T00:10:00-04:00,Three shot in Mattapan,Shooting,17 Elizabeth St.,02126
2015-07-26T07:00:00-04:00,Two charged with Roxbury carjacking,Carjacking,Blue Hill Ave. and W. Cottage St.,02119
2015-07-25T21:25:00-04:00,Man stabbed in Dudley Square,Stabbing,Harrison Ave. and Ziegler St.,02119
2015-07-25T15:30:00-04:00,Two shot in Roxbury,Shooting,Homestead St. and Pleasanton St.,02121
2015-07-24T14:47:00-04:00,"Dorchester traffic stop ends with teen arrested for possession of a loaded gun, police say",Illegal gun possession,Roseland St and Santuit St.,02124
2015-07-24T13:25:00-04:00,Brighton Center bank held up,Bank robbery,414 Washington St.,02108
2015-07-23T19:26:00-04:00,"Police: Jackson Square fight ends with two under arrest, one with a gun, one with a knife",Illegal gun possession,284 Centre St.,02130
2015-07-22T18:55:00-04:00,Woman shot near Morton Street,Shooting,29 Wildwood St.,02124
2015-07-21T15:20:00-04:00,Shots fired in Roxbury,Gunfire,25 Fenno St.,02119
2015-07-21T13:00:00-04:00,Shots fired outside Morton Street train station,Gunfire,875 Morton St.,02126
2015-07-20T22:25:00-04:00,Shots fired near Columbia Road,Gunfire,9 Powellton Rd.,02121
2015-07-20T22:15:00-04:00,Shots fired on Intervale Street,Gunfire,89 Intervale St.,02121
2015-07-20T10:30:00-04:00,Man found shot to death in Roslindale,Murder,50 Brookway Rd.,02131
2015-07-19T22:40:00-04:00,Person shot at in Heath Street drive-by,Gunfire,154 Heath St.,02130
2015-07-19T12:55:00-04:00,Man carjacked at gunpoint in Roxbury,Carjacking,Juniper St. and Cedar St.,02119
2015-07-19T12:35:00-04:00,"Man fires gun repeatedly behind Roxbury school, walks away",Gunfire,Walnut Ave. and Westminster Ave.,02119
2015-07-17T23:55:00-04:00,Two shot in Dorchester,Shooting,Harvard St. and Gleason St.,02121
2015-07-17T23:15:00-04:00,Food-delivery guy carjacked at knifepoint in East Boston,Carjacking,Monmouth St. and Marion St.,02128
2015-07-17T20:00:00-04:00,Man shot in the arm in Egleston Square,Shooting,Dixwell St. and Columbus Ave.,02119
2015-07-16T23:30:00-04:00,Two shot on Mission Hill,Shooting,Horadan Way,02120
2015-07-15T23:10:00-04:00,"Man attacked, robbed elderly woman at Savin Hill T stop",Assault and battery,121 Savin Hill Ave.,02125
2015-07-14T22:20:00-04:00,Gunfire exchange between suspects and police in Dorchester,Gunfire,Bowdoin Ave. and Nottingham St.,02121
2015-07-14T19:40:00-04:00,Officer suffers head trauma in Mattapan incident,Assault and battery,85 Hiawatha Rd.,02126
2015-07-14T19:24:00-04:00,Police: Framingham man didn&#039;t have much time to enjoy the Mercedes SUV he carjacked in Bay Village,Carjacking,8 Church St.,02116
2015-07-14T18:50:00-04:00,Person shot in Mattapan church parking lot,Shooting,1500 Blue Hill Ave.,02126
2015-07-14T10:30:00-04:00,Person robbed by men with knife in Roslindale,Armed robbery,50-66 Clare Ave.,02131
2015-07-14T01:15:00-04:00,Man shot near Holborn Street murder scene,Shooting,22 Holborn St.,02121
2015-07-12T23:50:00-04:00,Two shot in Dorchester,Shooting,67 Washington St.,02135
2015-07-12T22:45:00-04:00,Person stabbed on Shawmut Avenue along Ramsay Park,Stabbing,Shawmut Ave. and Hammond St.,02118
2015-07-11T22:15:00-04:00,Man shot twice in the legs in Roxbury apartment,Shooting,Academy Terrace and Academy Rd.,02119
2015-07-11T17:55:00-04:00,Man shot to death in Ashmont,Murder,88 Bailey St.,02124
2015-07-11T02:14:00-04:00,Person robbed at gunpoint in South Boston,Armed robbery,E. 8 St. and K St.,02127
2015-07-10T16:50:00-04:00,Panic on the bus when man boards with what look like dozens of bullets strapped to his waist,Illegal ammunition possession,1-3 Franklin St.,02108
2015-07-08T07:30:00-04:00,"DA: Woman faces charges after shoving elderly woman, who falls, hits head in Chinatown",Assault and battery,Essex St. and Chauncy St.,02111
2015-07-07T03:00:00-04:00,Woman with shamrock tattoo sought for Dorchester bank robbery,Bank robbery,585 Columbia Rd.,02125
2015-07-06T22:40:00-04:00,Person stabbed on MBTA bus in Mattapan,Stabbing,Blue Hill Ave. and Walk Hill St.,02126
2015-07-06T21:45:00-04:00,Shots fired in Roxbury,Gunfire,15 St. Richard St.,02119
2015-07-06T03:30:00-04:00,Man shot in South Boston armed robbery,Shooting,128 Msgr O'Callaghan Way,02127
2015-07-04T22:45:00-04:00,"Another double shooting, another man dead",Murder,12 Holborn St.,02121
2015-07-04T22:00:00-04:00,Police hunt alleged gay basher in Kenmore Square attack,Assault and battery,Kenmore Square,02215
2015-07-04T18:15:00-04:00,Car hit by gunfire in Roxbury,Gunfire,124 Eustis St.,02119
2015-07-04T02:30:00-04:00,Woman knocked down by man who tried to drag her behind a building on Mission Hill,Assault and battery,Huntington Ave. and Colburn St.,02115
2015-07-02T23:00:00-04:00,Two shot in Roxbury; one dies,Murder,21 Greenville St.,02119
2015-07-01T20:50:00-04:00,Somebody stabbed on Seaver Street,Stabbing,331 Seaver St.,02121
2015-07-01T14:05:00-04:00,Man shot in Mattapan; suspect nabbed,Shooting,Fessenden St. and Norfolk St.,02126
2015-06-29T22:05:00-04:00,Shots fired in Dorchester,Gunfire,37 Kerwin St.,02124
2015-06-29T07:00:00-04:00,Police hunt man for two Mission Hill break-ins,Break in,43 Hillside St.,02120
2015-06-27T23:15:00-04:00,Shot fired in Jamaica Plain,Gunfire,48 Round Hill St.,02130
2015-06-27T13:00:00-04:00,Three children stabbed in Hyde Park home,Stabbing,1608 River St.,02136
2015-06-26T08:00:00-04:00,Mother&#039;s boyfriend charged with Bella&#039;s murder,Murder,Maxwell St.,02124
2015-06-25T00:10:00-04:00,"Police: North Station panhandler stabs man who wouldn&#039;t give him money, punches another",Assault and battery with a dangerous weapon,135 Causeway St.,02114
2015-06-24T22:50:00-04:00,Shots fired in Egleston Square,Gunfire,Waldren Rd. and Westminster Ave.,02119
2015-06-21T23:25:00-04:00,Shots fired on Maxwell Street in Dorchester,Gunfire,18 Maxwell St.,02124
2015-06-21T16:30:00-04:00,Police: Man went berserk with a hammer in South Boston until a cop took aim at him with a beanbag gun,Assault with a dangerous weapon,838 E. Broadway,02127
2015-06-21T03:00:00-04:00,Shots fired in Allston,Gunfire,150 Brighton Ave.,02134
2015-06-21T00:05:00-04:00,Dorchester party ends in gunfire; one car hit,Gunfire,89 Westville St.,02124
2015-06-20T20:50:00-04:00,Somebody stabbed on Linden Street in Allston,Stabbing,20 Linden St.,02134
2015-06-20T16:20:00-04:00,One shot in Uphams Corner,Shooting,Dudley St. and Nonquit St.,02125
2015-06-19T21:10:00-04:00,Person shot in Madison Park,Shooting,Kerr Way and Ruggles Street,02120
2015-06-19T14:40:00-04:00,Officers shoot man who came at them with a knife on the Silber Footbridge,Shooting,Silber Way and Back Street,02215
2015-06-16T20:45:00-04:00,Three shot in Dorchester,Shooting,64 Lawrence Ave.,02121
2015-06-16T13:10:00-04:00,"As cops are in a Dorchester apartment seizing a gun and drugs, they hear a knock at the door",Illegal gun possession,29 Cunningham St.,02125
2015-06-14T22:00:00-04:00,Leather District brawl ends with person hit in the head with a bottle,Assault and battery with a dangerous weapon,Lincoln St. and Beach St.,02111
2015-06-13T20:30:00-04:00,Man shot at Egleston Square party; homicide unit summoned,Shooting,30 Egleston St.,02130
2015-06-13T00:30:00-04:00,Person shot in Dorchester,Shooting,28 York St.,02121
2015-06-12T04:15:00-04:00,Person shot in lower Roxbury,Shooting,625 Shawmut Ave.,02118
2015-06-10T20:05:00-04:00,Teen shot in the head on Fuller Street in Dorchester,Murder,128 Fuller St.,02124
2015-06-10T17:20:00-04:00,Car shot in Dorchester; occupants not injured,Gunfire,Milton Avenue and Armandine St.,02124
2015-06-10T05:00:00-04:00,Man shot in early morning Ashmont robbery,Shooting,Bailey St. and Dorchester Ave.,02124
2015-06-09T18:44:00-04:00,Police: Teen with loaded gun in hand arrested after foot chase,Illegal gun possession,Winthrop St. and Greenville St.,02119
2015-06-06T20:35:00-04:00,Police: Gyrating man arrested at Back Bay station for indecent assault and battery,Indecent assault and battery,145 Dartmouth St.,02116
2015-06-06T03:42:00-04:00,"Police: Scooter driver, gun-packing passenger try to speed away from officers, fail",Illegal gun possession,Humboldt Ave. and Martin Luther King Blvd.,02119
2015-06-04T09:45:00-04:00,Man stabbed repeatedly at Hyde Park Avenue soccer field,Stabbing,Hyde park Ave. and Wyvern St.,02131
2015-06-02T17:30:00-04:00,Teen stabbed on Jones Hill in Dorchester,Stabbing,150 Hancock St. Dorchester,02125
2015-06-02T11:20:00-04:00,Charlestown bank held up,Bank robbery,437 Rutherford Ave.,02129
2015-06-02T06:59:00-04:00,"FBI, BPD shoot and kill suspect outside Roslindale drugstore; say he wouldn&#039;t drop large knife, but brother disputes that",Gunfire,4600 Washington St.,02131
