datetime,title,crime_type,address,zip
2016-05-01T01:05:00-04:00,Man remains in induced coma three weeks after brutal attack at Fenway bar,Assault and battery with a dangerous weapon,1270 Boylston St.,02215
2016-04-30T11:30:00-04:00,Police charge Blue Hill Avenue market was selling more than just milk and bread,Illegal drug possession,734 Blue Hill Ave.,02121
2016-04-30T10:30:00-04:00,"Man disappointed with refrigerator delivery gets out rifle and orders delivery guys to leave, police say",Assault with a dangerous weapon,2 Folsom Ave.,02120
2016-04-27T23:00:00-04:00,Person shows up shot at local ER; may have happened on Walnut Park near Egleston Square,Shooting,30 Walnut Park,02119
2016-04-27T20:00:00-04:00,Man already charged with attacking woman on the T now charged with attacking teen at T stop,Indecent assault and battery,Washington St. and Winter St.,02108
2016-04-26T22:25:00-04:00,Knifepoint robbery in the South End,Armed robbery,145 W. Concord St.,02118
2016-04-26T22:00:00-04:00,"Pizza guy robbed at knifepoint, his car stolen in Mattapan",Armed robbery,20 Almont St.,02126
2016-04-26T20:50:00-04:00,Car taken at gunpoint in Brighton,Carjacking,N. Beacon St. and Market St.,02135
2016-04-26T20:00:00-04:00,Man stabbed on Burrell Street in Roxbury,Shooting,19 Burrell St.,02119
2016-04-25T12:00:00-04:00,Two BPD officers injured in Copley Square library; man in custody,Assault and battery,Dartmouth St. and Boylston St,02116
2016-04-24T18:45:00-04:00,"Police: Man spits at bus driver, tries to fend off cops with a shopping cart",Assault and battery,Warren St. and Moreland St.,02119
2016-04-24T16:50:00-04:00,Roxbury shoe store held up at gunpoint,Armed robbery,2189 Washington St.,02119
2016-04-24T12:04:00-04:00,Gunfire near Madison Park basketball courts,Gunfire,Kerr Way and Ruggles St.,02120
2016-04-22T23:15:00-04:00,Man shot in Archdale project in Roslindale,Shooting,95 Archdale Rd.,02131
2016-04-22T15:50:00-04:00,Jamaica Plain bank held up,Bank robbery,515 Centre St.,02130
2016-04-21T21:30:00-04:00,Man shot in Charlestown,Shooting,10 McNulty Ct.,02129
2016-04-21T14:05:00-04:00,Hyde Park bank held up,Bank robbery,1065 Truman Parkway,02136
2016-04-20T17:25:00-04:00,Shots exchanged near Madison Park,Gunfire,DeWitt Dr. and Estabrook Rd.,02120
2016-04-20T11:15:00-04:00,One shot near Egleston Square,Shooting,42 Walnut Park,02119
2016-04-20T11:00:00-04:00,"Woman, teen charged with armed home invasion in Dorchester",Armed home invasion,Trescott St.,02125
2016-04-19T22:15:00-04:00,Shots fired in Roxbury,Gunfire,33 Bethune Way,02119
2016-04-18T21:10:00-04:00,Woman stabbed in the arm on MLK Boulevard,Stabbing,330 Martin Luther King Blvd.,02119
2016-04-17T23:45:00-04:00,Food delivery guy robbed at knifepoint in Mattapan,Armed robbery,70 Tennis Rd.,02126
2016-04-17T16:48:00-04:00,Police hunt woman they say pushed toddler to the ground after cursing at her in the Public Garden,Assault and battery,Charles St. and Beacon St.,02116
2016-04-17T11:30:00-04:00,Dorchester man who keeps getting arrested on gun charges gets arrested on gun charges,Illegal gun possession,6 Castlegate Rd.,02121
2016-04-17T03:00:00-04:00,Quincy man dies while trying to break up fight in front of Dorchester tavern,Murder,780 Adams St.,02124
2016-04-15T21:50:00-04:00,Man shot in Mattapan,Shooting,River St. and Rector Rd.,02126
2016-04-14T15:36:00-04:00,Three arrested after gunfire on Ashmont Street,Illegal gun possession,11 Ashmont St.,02124
2016-04-11T15:00:00-04:00,West Roxbury bank held up,Bank robbery,1905 Centre St.,02132
2016-04-09T10:45:00-04:00,Blue Hill Avenue market held up at gunpoint,Armed robbery,696 Blue Hill Ave.,02121
2016-04-06T08:30:00-04:00,Student stabbed at West Roxbury high school; another student charged,Stabbing,1205 VFW Parkway,02132
2016-04-05T08:30:00-04:00,"Dorchester driver charged with hitting three cars, knocking down woman and running over her foot",Leaving the scene of a personal-injury accident,Ellington St. and Blue Hill Ave.,02121
2016-04-02T22:30:00-04:00,Drive-by shooters miss woman but hit her car in Newmarket Square,Gunfire,870 Massachusetts Ave.,02118
2016-04-02T22:00:00-04:00,Armed robbery in Chinatown by man in a skull mask,Armed robbery,Washington St. and Beach St.,02116
2016-04-01T11:25:00-04:00,"Man robs Grove Hall bank, but may not have gotten far - suspect grabbed after short foot chase",Bank robbery,648 Warren St.,02121
2016-03-31T21:45:00-04:00,Man stomped outside Mission Hill market,Assault and battery with a dangerous weapon,680 Parker St.,02120
2016-03-31T21:10:00-04:00,Two stabbed in the Leather District,Stabbing,Beach St. and Lincoln St.,02111
2016-03-31T18:15:00-04:00,Shots fired in Roxbury,Gunfire,Blue Hill Ave. and Dudley St.,02119
2016-03-31T17:30:00-04:00,DA: Serial drug dealer arrested because somebody thought it odd a guy would be climbing scaffolding while holding a gun,Illegal gun possession,692 Columbia Rd.,02125
2016-03-31T12:45:00-04:00,Citizens Bank downtown robbed,Bank robbery,73 Tremont St.,02108
2016-03-31T09:35:00-04:00,Man tries to rob Kenmore Square bank; fails,Bank robbery,560 Commonwealth Ave.,02215
2016-03-30T12:00:00-04:00,Noon gunfire on Roxbury street,Gunfire,Clarence St. and Dudley St.,02119
2016-03-27T21:30:00-04:00,Calm after Lenox Street sweep didn&#039;t last long: Multiple shots fired near Ramsay Park,Gunfire,Shawmut Ave. and Kendal St.,02118
2016-03-27T02:10:00-04:00,"One man shot to death, another stabbed in Mattapan incident",Murder,227 River St.,02126
2016-03-26T03:41:00-04:00,Gunfire erupts overnight in Roslindale,Gunfire,44 Kittredge St.,02131
2016-03-26T00:30:00-04:00,Man attacks woman at Ashmont and Florida streets in Dorchester,Indecent assault and battery,Ashmont St. and Florida St.,02124
2016-03-24T13:00:00-04:00,Man in car shot in hand,Shooting,121 Devon St.,02121
2016-03-23T15:30:00-04:00,Man arrested after midday gunfire in Roxbury,Gunfire,47 Nazing St,02121
2016-03-22T23:35:00-04:00,Two shot in Egleston Square,Shooting,127 School St.,02119
2016-03-22T22:30:00-04:00,Man shot to death in East Boston,Murder,7 Wordsworth St.,02128
2016-03-22T08:55:00-04:00,"Police: South Boston bank robber tries to make getaway in cab, fails",Bank robbery,441 W. Broadway,02127
2016-03-21T21:35:00-04:00,Pizza delivery guy held up at gunpoint in Roslindale,Armed robbery,115 Brookway Rd.,02131
2016-03-21T13:15:00-04:00,Police charge man as Green Line masturbator,Open and gross behavior,Arlington St. and Boylston St.,02116
2016-03-21T03:00:00-04:00,"Two shot, one dead in Roxbury",Murder,66 Humboldt Ave.,02119
2016-03-21T03:00:00-04:00,Women sexually attacked after getting into vehicles they thought were from a ride-share company,Sexual attack,2 Center Plaza,02108
2016-03-20T15:30:00-04:00,DA: Man was trying to sell drugs to passengers on a T bus after the parade when his loaded gun fell out of his pants,Illegal gun possession,Summer St. and E. 1 St.,02127
2016-03-17T17:25:00-04:00,"Man shot, car hit in hail of gunfire on Blue Hill Avenue near Floyd Street",Shooting,998 Blue Hill Ave.,02124
2016-03-17T15:20:00-04:00,Police hunt man for knifepoint robbery at Sullivan Square T stop,Armed robbery,1 Cambridge St.,02114
2016-03-14T10:24:00-04:00,"Woman indecently attacked on Jamaica Plain street this morning, police say",Indecent assault and battery,127 Chestnut Ave.,02130
2016-03-11T16:45:00-05:00,Multiple shots fired on a Dorchester street,Gunfire,Trull St. and Glen St.,02125
2016-03-10T20:42:00-05:00,Two teens arrested for armed robbery in East Boston; third suspect at large,Armed robbery,44 Brooks St.,02135
2016-03-09T19:20:00-05:00,Roxbury man charged with shooting gun in the South End,Gunfire,72 W. Newton St.,02118
2016-03-09T18:00:00-05:00,Gunfire erupts in Mattapan,Gunfire,W. Selden St. and Morton St.,02126
2016-03-09T17:20:00-05:00,Gunfire erupts in Dorchester,Gunfire,Ellington St. and Erie St.,02121
2016-03-05T21:20:00-05:00,Person robbed at gunpoint by two kids in the Fenway,Armed robbery,24 Westland Ave.,02115
2016-03-04T14:50:00-05:00,Teenager stabbed at Stony Brook T stop,Stabbing,180 Lamartine St.,02130
2016-03-04T08:44:00-05:00,Mole man robs East Boston Savings Bank in South Boston,Bank robbery,708 E. Broadway,02127
2016-03-03T01:45:00-05:00,Man who had a murder charge dismissed is arrested on gun charges,Illegal gun possession,68 Norfolk St.,02124
2016-03-01T15:15:00-05:00,Dorchester teens face major time for attacking mailman,Assault and battery,Cushing Ave. and Windermere Rd.,02125
2016-02-29T02:13:00-05:00,Shots fired in the Fenway,Gunfire,St. Botolph St. and Gainsborough St.,02115
2016-02-27T16:30:00-05:00,Two shots fired into car in Roslindale,Gunfire,30 Sherwood St.,02131
2016-02-27T12:58:00-05:00,"Gun-toting road rager foiled in getaway when his moped stalls, police say",Assault with a dangerous weapon,Massachusetts Ave. and Tremont St.,02118
2016-02-27T12:50:00-05:00,Police say Dorchester teen was armed with both a loaded gun and a box cutter,Illegal gun possession,Talbott Ave. and Westcott St.,02124
2016-02-27T09:26:00-05:00,Man in black holds up South Boston bank,Bank robbery,430 W. Broadway,02127
2016-02-27T01:56:00-05:00,Group that brought a length of pipe to a Waterfront gun fight not interested in helping police find their attackers,Assault with a dangerous weapon,Marina Park Dr.,02210
2016-02-22T23:00:00-05:00,Man stabbed in the arm in Dorchester,Stabbing,41 Kingsdale St.,02124
2016-02-21T16:37:00-05:00,Teen stabbed to death in Dorchester,Murder,203 Columbia Rd.,02121
2016-02-20T20:00:00-05:00,A metal detector might have come in handy at a Dorchester get-together,Illegal gun possession,8 Theodore St.,02124
2016-02-20T11:50:00-05:00,Two face charges for loaded gun found in baby seat in Dorchester,Illegal gun possession,193 Norfolk St.,02124
2016-02-20T03:30:00-05:00,Person shot in the chest in Dorchester,Shooting,Wales St. and Kingsdale St.,02124
2016-02-18T17:30:00-05:00,Barricaded man forces shutdown of major Roslindale intersection at rush hour,Barricaded person,American Legion Highway and Stella Road,02131
2016-02-18T00:11:00-05:00,"Police: Dorchester 15-year-old packing three guns fires on group of people, misses",Illegal gun possession,30 Bailey St.,02124
2016-02-15T18:00:00-05:00,Several hundred bags of heroin and cocaine and ammunition seized in South Boston raids,Illegal drug possession,433 Old Colony Ave.,02127
2016-02-13T00:05:00-05:00,A girl gets bleach thrown in her face; now Mattapan roller rink is in hot water,Assault and battery with a dangerous weapon,Rhoades St. and Blue Hill Ave.,02124
2016-02-12T10:30:00-05:00,"Police: Gun battle inside Dorchester home followed by confrontation with police; one dead, two injured",Shooting,107 Devon St.,02121
2016-02-10T18:00:00-05:00,Dorchester market robbed at gunpoint; suspects arrested after standoff at nearby apartment,Armed robbery,Savin Hill Ave. and Pleasant St.,02125
2016-02-10T16:45:00-05:00,Two robbed at gun- and knifepoint in Dorchester schoolyard,Armed robbery,270 Columbia Rd.,02121
2016-02-10T15:00:00-05:00,Man missing teeth wanted for knifepoint holdups downtown and in Chinatown,Armed robbery,Washington St. and Boylston St.,
2016-02-07T21:10:00-05:00,Two robbed of phone at gunpoint outside Forest Hills T stop,Armed robbery,Hyde Park Ave. and Tower Rd.,02130
2016-02-06T23:13:00-05:00,"Police: Guy smashes bottle across man&#039;s head at one bar, calmly walks down street to another bar",Assault and battery with a dangerous weapon,658 E. Broadway,02127
2016-02-06T20:40:00-05:00,"Police: East Boston drug dealer swallows some of his product, tries to pull out switchblade when officers show up",Illegal drug possession,Liverpool St. and Maverick St.,02128
2016-02-05T01:00:00-05:00,Man stabbed on Vassar Street in Dorchester,Stabbing,Vassar St.,02121
2016-02-04T22:45:00-05:00,"Fields Corner battle leaves man stabbed, two others shot",Shooting,500 Geneva Ave.,02122
2016-02-04T05:45:00-05:00,Man shot to death in Roxbury,Murder,55 Brookledge Rd.,02121
2016-02-03T16:15:00-05:00,Centre Street in Jackson Square shut as police investigate gunfire,Shooting,Centre St. and Wise St.,02130
2016-02-02T10:45:00-05:00,Dog shot and killed on Annunciation Road,Gunfire,58 Annunciation Rd.,02120
2016-02-01T01:40:00-05:00,"Two pedestrians hit in Chinatown, one dragged three miles to Dorchester",Hit and run,Kneeland St. and Harrison Ave.,02111
2016-01-31T21:45:00-05:00,Roxbury toddler rushed to hospital after trauma; homicide unit brought in just in case,Murder,23 Alpine St.,02119
2016-01-31T21:05:00-05:00,Shots fired in Egleston Square,Gunfire,Washington St. and Walnut Park,02119
2016-01-30T00:15:00-05:00,Shots fired in Dorchester,Gunfire,29 Armandine St.,02124
2016-01-28T23:40:00-05:00,Man robbed at knifepoint in Charlestown,Armed robbery,50 Medford St.,02129
2016-01-28T16:03:00-05:00,"Police seize more drugs, sawed off shotgun in Roslindale",Illegal gun possession,127 Brown Ave.,02131
2016-01-28T15:00:00-05:00,"Resident of Roslindale apartment building for the elderly and disabled charged with gun, heroin possession",Illegal gun possession,1 Cliffmont St.,02131
2016-01-28T12:51:00-05:00,Man shot at twice in Roslindale robbery attempt,Armed robbery,950 American Legion Highway,02136
2016-01-27T11:59:00-05:00,"Teen gets into English High with a gun, police say",Illegal gun possession,144 McBride St.,02130
2016-01-27T01:40:00-05:00,Man shot and killed in Dorchester,Murder,Washington St. and Dunbar Ave.,02124
2016-01-26T22:28:00-05:00,Gunfire erupts in the South End,Gunfire,Washington St. and Mystic St.,02118
2016-01-25T22:20:00-05:00,"Angry Florida man with a gun turns Back Bay, cab in the South End into his own personal shooting ranges, police say",Gunfire,Arlington St. and Newbury St.,02116
2016-01-25T14:40:00-05:00,Person shot in the stomach in argument over Dorchester parking space,Shooting,69 Nightingale St.,02124
2016-01-24T22:09:00-05:00,Roxbury market held up at gunpoint,Armed robbery,394 Warren St.,02119
2016-01-24T01:00:00-05:00,"Ten arrested, more sought for vicious beating at Brighton Center bar that sent man to the hospital",Assault and battery with a dangerous weapon,304 Washington St.,02135
2016-01-22T07:00:00-05:00,"Police say Roxbury man points guns at neighbor, then retreats to his apartment and barricades himself in",Assault with a dangerous weapon,79 Hutchings St.,02121
2016-01-20T10:00:00-05:00,Roslindale man who keeps getting arrested on drug and weapons charges gets arrested on drug and weapons charges,Illegal gun possession,48 Colberg Ave.,02131
2016-01-19T14:30:00-05:00,Two shot at Maverick T stop,Shooting,220 Sumner St.,02128
2016-01-19T10:35:00-05:00,"Back in the day, kids used lanyards for keys or IDs",Illegal gun possession,14 Quincy St.,02113
2016-01-18T21:05:00-05:00,Armed robbery in the Fenway,Armed robbery,Hemenway St and Westland Ave.,02115
2016-01-16T22:15:00-05:00,Person shot in the leg in Fields Corner,Gunfire,Geneva Ave. and Vinson St.,02124
2016-01-16T02:00:00-05:00,The bouncer thought he&#039;d been punched and ran after his attacker; then he noticed the blood,Stabbing,174 Lincoln St.,02111
2016-01-14T22:40:00-05:00,Police: Man tries to emphasize a point in a Mattapan argument by waving a loaded gun around,Illegal gun possession,Seminole St.,02126
2016-01-14T16:00:00-05:00,Gunman takes man&#039;s laptop - and his jacket,Armed robbery,Corwin St. and Arcadia St.,02122
2016-01-13T19:39:00-05:00,Man found fatally shot in Mission Hill house,Murder,55 Fenwood St.,02115
2016-01-10T01:35:00-05:00,Teen shot to death in East Boston,Shooting,144 Falcon St.,02128
2016-01-08T22:05:00-05:00,Police: Woman tearfully said purse with gun in her lap wasn&#039;t hers but made no similar claim about gun in her underwear,Illegal gun possession,43 Oldfields Rd.,02121
2016-01-08T21:30:00-05:00,Man stabbed repeatedly in Dorchester,Stabbing,12 York St.,02121
2016-01-08T10:25:00-05:00,Boston police officer shot in the leg in Dorchester,Shooting,33 Mt. Bowdoin Terrace,02121
2016-01-07T11:10:00-05:00,Gunfire racks Codman Square intersection,Gunfire,Kenwood St. and Washington St.,02124
2016-01-06T15:00:00-05:00,Dorchester man charged with holding up Lower Mills bank,Bank robbery,2250 Dorchester Ave.,02124
2016-01-03T19:40:00-05:00,Dorchester market robbed at gunpoint,Armed robbery,760 Washington St.,02111
2016-01-01T16:14:00-05:00,Armed robbery and pistol whipping near Egleston Square; three teens arrested,Armed robbery,Walnut Park and Walnut Ave.,02119
2016-01-01T06:45:00-05:00,Woman sexually attacked at knifepoint in Dorchester,Sexual attack,Annabel St. and Columbia Rd.,02125
2016-01-01T05:30:00-05:00,Woman shot in Dorchester,Shooting,Norfolk St. and Talbot Ave.,02124
2016-01-01T02:00:00-05:00,"Gotterdammerung on Congress Street: Man yelling about end times punches cop in face, police say",Assault and battery,1 City Hall Sq.,02108
2015-12-30T23:00:00-05:00,Man shot in East Boston,Shooting,Decatur St and Border St.,02128
2015-12-30T22:05:00-05:00,Person shot in the leg in Dorchester,Shooting,Gleason St.,02121
2015-12-30T19:05:00-05:00,Woman robbed at gunpoint in Dorchester,Armed robbery,Sawyer Ave. and Pleasant St.,02125
2015-12-30T17:05:00-05:00,Woman robbed at gunpoint in Roslindale,Armed robbery,Bradeen St.,02131
2015-12-30T13:40:00-05:00,Three arrested for armed holdup in Dorchester after brief high-speed chase up Morrissey Boulevard,Armed robbery,Bay St.,02125
2015-12-29T08:47:00-05:00,"Two shot in Mattapan, one dead",Murder,23 Wilmore St.,02126
2015-12-28T22:15:00-05:00,Manhunt shuts Orange Line in Charlestown,Illegal gun possession,Putnam St.,02128
2015-12-27T20:30:00-05:00,Person shot in the chest in Mattapan,Shooting,63 Rosewood St.,02126
2015-12-27T17:20:00-05:00,Armed robbery at Roslindale market,Armed robbery,165 Belgrade Ave.,02131
2015-12-27T16:00:00-05:00,Person found stabbed inside Jackson Square T stop; Bromley-Heath building also investigated,Stabbing,277 Centre St.,02130
2015-12-26T21:10:00-05:00,Armed home invasion in Dorchester,Armed home invasion,193 Norfolk St.,02124
2015-12-26T21:00:00-05:00,"Gunfire leaves house, two cars with bullet holes in Dorchester",Gunfire,21 Ellington St.,02121
2015-12-26T20:35:00-05:00,Man shot in the leg in Charlestown,Shooting,160 Bunker Hill St.,02129
2015-12-26T19:25:00-05:00,Teen shot in Dorchester,Shooting,Stratton St.,02124
2015-12-26T09:34:00-05:00,Man stabbed in Day Square,Stabbing,282 Bennington St.,02128
2015-12-25T17:30:00-05:00,Woman shot in the thigh in Roxbury,Shooting,14 Circuit St.,02119
2015-12-25T06:30:00-05:00,Three charged with Christmas home invasion in East Boston,Armed home invasion,1115 Saratoga St.,02128
2015-12-23T18:15:00-05:00,Man shot in the leg on Tremont Street at Mass. Ave. in the South End,Shooting,771 Tremont St.,02118
2015-12-23T15:45:00-05:00,Two shot at Bromley-Heath,Shooting,277 Centre St.,02130
2015-12-21T21:45:00-05:00,Man shot in Roxbury,Shooting,Dale St. and Sherman St.,02119
2015-12-21T21:00:00-05:00,Person stabbed in Roxbury,Stabbing,Highland St. and Dorr St.,02119
2015-12-21T09:00:00-05:00,DA: Men arrested over weekend on gun charges beat another man in court lockup this morning,Assault and battery,510 Washington St.,02111
2015-12-20T21:42:00-05:00,Person shot several times in Jamaica Plain,Shooting,Gay Head St. and Minden St.,02130
2015-12-20T13:30:00-05:00,Man robbed at gunpoint in Fields Corner parking lot,Armed robbery,1440 Dorchester Ave.,02122
2015-12-19T12:15:00-05:00,"Police: Two guys with a gun get into cab; officers follow until the driver commits a traffic violation, then pull the cab over",Illegal gun possession,150 Norwell St.,02121
2015-12-18T16:00:00-05:00,Teen shot to death on Annunciation Road,Murder,60 Annunciation Rd.,02120
2015-12-18T10:32:00-05:00,Fields Corner bank robber strikes again,Bank robbery,217 Adams St.,02122
2015-12-17T13:30:00-05:00,Police: Orange Line riders break up man&#039;s indecent assault on a woman,Indecent assault and battery,Washington St. and Summer St.,02108
2015-12-16T21:50:00-05:00,Man found shot after gunfire just off Mass. Ave. and Harrison,Gunfire,Northampton St. and Reed St.,02118
2015-12-16T20:45:00-05:00,Causeway Street 7-Eleven robbed at knifepoint,Armed robbery,91 Causeway St.,02114
2015-12-16T15:00:00-05:00,Woman sought for bank robberies in Fields Corner and downtown,Bank robbery,1442 Dorchester Ave.,02122
2015-12-15T11:55:00-05:00,Teen charged with shooting at group of people in front of Roxbury court,Gunfire,85 Warren St.,02129
2015-12-14T13:45:00-05:00,Police use pepper spray to disarm man they say was menacing people with a large serving fork,Assault with a dangerous weapon,1960 Washington St.,02118
2015-12-14T13:37:00-05:00,Man sought for Fields Corner bank robbery,Bank robbery,1440 Dorchester Ave.,02122
2015-12-11T14:15:00-05:00,Mid-day gunfire in Dorchester,Gunfire,Wilmington Ave. and Nevada St.,02124
2015-12-09T20:22:00-05:00,Man sitting in car shot to death in Dorchester,Murder,120 Southern Ave.,02124
2015-12-09T01:30:00-05:00,Man fatally shot in the chest in the South End,Murder,17B Aguadilla St.,02118
2015-12-08T00:30:00-05:00,Man stabbed to death in Dorchester,Murder,5 Nightingale St.,02124
2015-12-07T22:24:00-05:00,Shots fired in Dorchester,Gunfire,Dacia St. and Woodcliff St.,02125
2015-12-06T15:15:00-05:00,Shots fired in the South End,Gunfire,89 W. Springfield St.,02118
2015-12-06T00:55:00-05:00,Teen slashed in East Boston,Stabbing,Ashley St. and Breed St.,02128
2015-12-05T23:10:00-05:00,Man shot in the face in Roxbury,Shooting,Kerr Way,02120
2015-12-05T23:00:00-05:00,Person shot in Dorchester,Shooting,3 Elm St.,02129
2015-12-05T20:25:00-05:00,"Man shot repeatedly in South Boston, dies",Murder,425 Old Colony Ave.,02127
2015-12-03T19:00:00-05:00,Beverly man charged with throwing beer bottle at T worker at Haymarket,,Congress St. and New Sudbury St.,02108
2015-12-02T11:30:00-05:00,Police: Foreigner just loves that dirty water - and drugs and guns,Illegal gun possession,276 Adams St.,02122
2015-11-30T12:20:00-05:00,Teen shot outside O&#039;Bryant School,Shooting,55 Malcolm X. Blvd,02120
2015-11-29T00:52:00-05:00,Police: Loud party in Dorchester ends with cops ordering everybody to the ground after gun discovered,Illegal gun possession,42 Norton St.,02125
2015-11-27T10:00:00-05:00,"If you can&#039;t do the time, then don&#039;t wear the lime",Armed robbery,194 Dudley St.,02119
2015-11-27T02:10:00-05:00,Early morning gunfire in Dorchester,Gunfire,Harvard St. and Algonquin St.,02124
2015-11-27T01:30:00-05:00,Police investigate possible attack outside Pi Alley bar,Stabbing,14 Pi Alley,02108
2015-11-26T02:00:00-05:00,"Shooting outside Fenway bar leaves one dead, three injured",Murder,19 Yawkey Way,02215
2015-11-26T02:00:00-05:00,"One shot, one stabbed in Allston",Shooting,Brighton Ave. and Harvard Ave.,02134
2015-11-25T15:05:00-05:00,"Cars, no people hit as gunfire erupts in Roxbury",Gunfire,Dearborn St. and Eustis St.,02119
2015-11-24T19:00:00-05:00,Five face charges over alleged sale of rifle in Roslindale parking lot,Illegal gun possession,718 American Legion Hwy,02131
2015-11-21T22:15:00-05:00,Man found shot in Roslindale cemetery,Shooting,427 Cummins Hwy,02131
2015-11-21T01:10:00-05:00,East Boston man says he has good alibi for Dorchester gun charges: He&#039;s blind,Illegal gun possession,Columbia Rd. and Washington St.,02121
2015-11-21T00:05:00-05:00,JP man arrested after gunfire in Roxbury,Gunfire,1176 Tremont St.,02120
2015-11-20T17:55:00-05:00,Two shot on Centre Street in Jamaica Plain; one dead,Murder,Centre St. and Wyman St.,02130
2015-11-19T23:30:00-05:00,Man found unconscious and bleeding at Roxbury bus stop; police hunt his attacker and a woman seen rifling through his pockets as he lay there,Assault and battery,Wshington St. and E. Lenox St.,02118
2015-11-19T21:15:00-05:00,Egleston Square argument ends with stabbing,Stabbing,11 Dixwell St.,02119
2015-11-19T16:50:00-05:00,Feds: Portable police-radio scanner didn&#039;t help Brighton bank robber with a 40-year record evade police,Bank robbery,391 Market St.,02135
2015-11-18T17:50:00-05:00,Shots fired on Columbus Avenue,Gunfire,Columbus Ave. and Dimock St.,02119
2015-11-17T15:00:00-05:00,Woman stabbed in Mattapan apartment building,Stabbing,435 River St.,02126
2015-11-16T18:40:00-05:00,"Guy tries, fails to hold up Truman Parkway store at knifepoint",Attempted armed robbery,674 Truman Parkway,02136
2015-11-16T12:40:00-05:00,Dorchester teacher robbed at knifepoint outside her school,Armed robbery,Columbia Rd. and Intervale St.,02121
2015-11-14T21:30:00-05:00,Police: Dorchester teen arrested with loaded gun at Bromley-Heath,Illegal gun possession,277 Centre St.,02130
2015-11-14T00:15:00-05:00,Shots fired in Roslindale,Gunfire,3 Beram Ave.,02131
2015-11-12T09:00:00-05:00,Mattapan man charged as fentanyl dealer,Illegal drug possession,20 Regis Rd.,02126
2015-11-12T06:00:00-05:00,DA: Dorchester man who has pursued life of violent crime gets arrested again,Illegal gun possession,15 Abbott St.,02124
2015-11-10T21:30:00-05:00,"Man hit in the back of the head, robbed at gunpoint in the South End",Armed robbery,W. Rutland Park,02118
2015-11-09T13:15:00-05:00,Gallivan Boulevard bank held up for second time in less than a month,Bank robbery,780 Gallivan Blvd.,02122
2015-11-08T19:00:00-05:00,Police: Officers dragged 100 yards by car driven by man they&#039;d just pulled over in Dorchester,Assault and battery with a dangerous weapon,Stratton St. and Westview St.,02124
2015-11-08T01:40:00-05:00,Roslindale bar rolls back last call after closing-hour fights; other bars also report closing-time violence,Assault and battery with a dangerous weapon,4187 Washington St.,02131
2015-11-06T22:35:00-05:00,Man opens fire in Roxbury,Gunfire,Wardman Rd. and Westminster Ave.,02119
2015-11-06T09:07:00-05:00,Police say 11-year-old girl indecently attacked in South Boston by apologetic man,Indecent assault and battery,1 Gavin Way,02127
