datetime,title,crime_type,address,zip
2016-10-14T16:00:00-04:00,Serial bank robber strikes again - robs same Brigham Circle bank he robbed last month,Bank robbery,6 Francis St.,02115
2016-10-13T21:40:00-04:00,Woman robbed at knifepoint in the Fens,Armed robbery,81 Agassiz Rd.,02215
2016-10-12T23:05:00-04:00,Two cops shot in East Boston gun battle; suspect dead,Shooting,136 Gladstone St.,02128
2016-10-12T15:00:00-04:00,Woman robbed at gunpoint in Mission Hill park,Armed robbery,Bucknam St. and Fisher Ave.,02120
2016-10-12T14:40:00-04:00,Boylston Street bank held up,Bank robbery,575 Boylston St.,02116
2016-10-12T13:40:00-04:00,Man robbed at gunpoint at Centre and Wyman in Jamaica Plain,Armed robbery,Centre St. and Wyman St.,02130
2016-10-11T04:00:00-04:00,"Man breaks into South End apartment, sexually attacks both occupants",Rape,Clarendon St. and Columbus Avenue,02116
2016-10-09T23:30:00-04:00,Two stabbed in separate incidents in Roxbury,Stabbing,Blue Hill Ave. and Dewey St.,02119
2016-10-09T23:30:00-04:00,Two stabbed in separate incidents in Roxbury,Stabbing,36 Edgewood St.,02119
2016-10-09T13:38:00-04:00,Man sought for attempted rape in Mission Hill park,Attempted rape,Kevin W. Fitzgerald Park,02121
2016-10-09T03:32:00-04:00,Person shot in Mattapan; three arrested,Shooting,156 Standard St.,02126
2016-10-09T01:00:00-04:00,"Girl, 9, shot in the back in Roxbury",Shooting,63 Annunciation Rd.,02120
2016-10-08T22:55:00-04:00,Man shot to death near Egleston Square,Murder,5 Cleaves Ct.,02119
2016-10-08T17:20:00-04:00,Barrage of gunfire on Mass. Ave. between Shawmut and Washington,Gunfire,623 Massachusetts Ave.,02118
2016-10-08T13:22:00-04:00,Armed robbers make getaway in Zipcar,Armed robbery,Columbus Ave. and Massachusetts Ave.,02118
2016-10-08T01:45:00-04:00,Man critically injured in closing-time stabbing on Stuart Street,Stabbing,100 Stuart St.,02116
2016-10-07T23:55:00-04:00,Person stabbed in South Boston,Stabbing,350 E. 8 St.,02127
2016-10-07T22:55:00-04:00,Man stabbed at Boylston and Tremont streets,Stabbing,Tremont St. and Boylston St.,02116
2016-10-07T00:07:00-04:00,DA: Woman told husband she would stab him and then she did - fatally,Murder,88 Wensley St.,02120
2016-10-07T00:00:00-04:00,"Chinatown fight leaves one stabbed, one smacked in the head with a cane",Stabbing,Beach St.,02111
2016-10-06T18:45:00-04:00,Man fatally shot in the head in Roxbury,Murder,Dearborn St. and Zeigler St.,02119
2016-10-04T16:45:00-04:00,Both suspects in Roslindale gun battle now in custody,Gunfire,37 Newburg St.,02116
2016-10-04T06:15:00-04:00,South Street Diner held up,Armed robbery,178 Kneeland St.,02111
2016-10-02T16:55:00-04:00,"Man shot in Dorchester; not long after, three arrested on gun charges nearby",Shooting,Bowdoin Ave. and Eldon St.,02121
2016-10-01T16:55:00-04:00,Man stabbed in the arm in Dorchester,Stabbing,1 Shandon Rd.,02124
2016-10-01T04:40:00-04:00,Person shot on Hartford Street in Dorchester,Shooting,Hartford St.,02125
2016-09-29T18:45:00-04:00,Police: Dorchester man arrested with loaded gun where another man was shot to death,Illegal gun possession,55 Downer Ave.,02125
2016-09-29T01:41:00-04:00,Police look for gunpoint rapist in Jamaica Plain,Rape,24 Gay Head St.,02130
2016-09-27T15:00:00-04:00,Man sought for gunpoint holdup of Dorchester credit union,Bank robbery,494 Gallivan Blvd.,02124
2016-09-27T01:05:00-04:00,Man shot to death in Bromley-Heath,Murder,267 Centre St.,02130
2016-09-25T20:15:00-04:00,Shots fired on Mt. Ida Road in Dorchester,Gunfire,75 Mt. Idea Rd.,02122
2016-09-25T02:15:00-04:00,Seven  stabbed in Theater District as clubs let out,Stabbing,279 Tremont St.,02116
2016-09-25T02:08:00-04:00,Man shot on Newbury Street early Sunday,Shooting,Newbury St. and Clarendon St.,02116
2016-09-24T02:00:00-04:00,"Closing-time &#039;riot-like situation&#039; outside downtown club ended with five arrests, four cops injured",Assault and battery,295 Franklin St.,02110
2016-09-24T00:30:00-04:00,Woman sexually attacked in what she thought was a ride share car in Allston,Sexual assault,161 Brighton Ave.,02134
2016-09-23T21:10:00-04:00,Man stabbed in South Boston,Stabbing,McDonough Way,02127
2016-09-22T22:00:00-04:00,Police investigate indecent assault on two women on Jamaica Pond path,Indecent assault and battery,Jamaicaway and Pond St.,02130
2016-09-21T21:20:00-04:00,Person shot in Mattapan,Shooting,Cedard St. and Sanford St.,02126
2016-09-20T21:50:00-04:00,Man stabbed in the hand in Uphams Corner,Stabbing,Dudley St. and Monadnock St.,02125
2016-09-20T20:45:00-04:00,Person shot in Roxbury,Shooting,Dudley St. and Miller Park,02119
2016-09-20T20:06:00-04:00,Man shot to death in Dorchester,Murder,55 Downer Ave.,02125
2016-09-20T17:30:00-04:00,Man stabbed in the Fenway,Stabbing,Park Dr. and Agassiz Rd.,02215
2016-09-19T16:10:00-04:00,Brigham Circle bank held up,Bank robbery,6 Francis St.,02115
2016-09-18T22:15:00-04:00,Person shot in the head in Allston,Shooting,20 Linden St.,02134
2016-09-17T02:20:00-04:00,One dead in Dorchester triple shooting,Murder,Nightingale St. and Wales St.,02124
2016-09-16T13:00:00-04:00,Dorchester bank held up,Bank robbery,585 Columbia Rd.,02125
2016-09-14T21:40:00-04:00,Gunfire in a Dorchester park,Gunfire,40 Bourneside St.,02124
2016-09-13T19:40:00-04:00,"Blocked in, gun suspect rams unmarked police cruiser in Roxbury, police say",Assault with a dangerous weapon,Geneva Ave. and Bowdoin St.,02121
2016-09-13T14:15:00-04:00,Shots fired in Roslindale,Gunfire,Washington St. and Granfield Ave.,02131
2016-09-10T23:10:00-04:00,Man shot in Dorchester,Shooting,Bowdoin St. and Tebroc St.,02122
2016-09-08T22:45:00-04:00,Shots fired on Walnut Avenue in Roxbury,Gunfire,334 Walnut Ave.,02119
2016-09-07T19:45:00-04:00,Man shot to death in Dorchester,Murder,10 Ripley Rd.,02121
2016-09-06T15:00:00-04:00,Man sought for Back Bay bank robbery,Bank robbery,575 Boylston St.,02116
2016-09-05T15:40:00-04:00,Stabbing at Dudley T stop,Stabbing,Dudley Station,02119
2016-09-05T04:11:00-04:00,Police hunt man for Greenway sexual assault early today,Sexual attack,State St. and Atlantic Ave.,02110
2016-09-04T11:40:00-04:00,"Police: Prowler pepper sprays cops, swings on rope from Allston roof to try to escape, punches man",Armed home invasion,19 St. Luke&#039;s Rd.,02134
2016-09-03T22:30:00-04:00,"Driver slams into woman on Morton Street, killing her, then speeds away",Hit and run,Morton St and Canterbury St.,02131
2016-09-02T21:00:00-04:00,Man shot near Egleston Square,Shooting,Walnut Park and Waldren Rd.,02119
2016-09-01T19:42:00-04:00,"Police: Gun-toting drug dealer, associate arrested in the Public Garden",Illegal gun possession,Boston Public Garden,02116
2016-08-27T20:45:00-04:00,"Woman stabbed on Olney Street, Dorchester",Stabbing,38 Olney St.,02121
2016-08-27T14:46:00-04:00,Two injured in large fight behind East Boston supermarket,Stabbing,246 Border St.,02128
2016-08-27T03:30:00-04:00,Man shot to death outside Jamaica Plain convenience store,Murder,454 Centre St.,02130
2016-08-27T01:45:00-04:00,Man shot to death in Dorchester,Murder,58 Westville St.,02124
2016-08-25T15:40:00-04:00,Bank on Hyde Park/Mattapan line held up,Bank robbery,860 River St.,02126
2016-08-25T10:05:00-04:00,Police: Chase of gun-toting Boston Common drug dealer ends in Winter Street struggle,Illegal gun possession,Winter St. and Tremont St.,02108
2016-08-25T01:12:00-04:00,Angry patron kicked out of Theater District club tries to carve up doorman,Stabbing,246 Tremont St.,02116
2016-08-25T01:00:00-04:00,Teen shot in the stomach in Dorchester,Shooting,McClellan St. and Page St.,02121
2016-08-24T02:40:00-04:00,New Hampshire bank-robbery suspect arrested after five-hour stand off in South Boston,Illegal gun possession,9 Orton Marotta Way,02127
2016-08-22T03:30:00-04:00,Gunfire overnight in Chinatown,Gunfire,15 Edinboro St.,02111
2016-08-22T01:00:00-04:00,Woman was marched half a mile to a rape by a man with a knife in the South End,Rape,687 Columbus Ave.,02120
2016-08-21T22:45:00-04:00,Man shot in Egleston Square,Shooting,School St. and Dixwell St.,02119
2016-08-21T20:25:00-04:00,Gunfire erupts in Fields Corner,Gunfire,21 Bourneside St.,02124
2016-08-21T19:10:00-04:00,Police: Shotgun-toting Mission Hill burglar foiled in getaway when jacket gets jammed in his bicycle wheel,Burglary,60 Wait St.,02120
2016-08-21T19:00:00-04:00,Man stabbed in the South End,Stabbing,73 Warren Ave.,02116
2016-08-20T23:45:00-04:00,Three shot on Blue Hill Avenue in Dorchester,Shooting,930 Blue Hill Ave.,02124
2016-08-20T00:15:00-04:00,"Two shot in Uphams Corner, one dead",Murder,6 Dudley Terrace,02125
2016-08-19T20:50:00-04:00,Man shot in the leg in Dorchester,Shooting,1474 Dorchester Ave.,02122
2016-08-18T22:20:00-04:00,Man shot in the back in Mattapan,Shooting,10 Orlando St.,02126
2016-08-18T17:10:00-04:00,"Two shot on Roslindale/Mattapan line, search extended to Forest Hills, Roxbury, three in custody",Shooting,Walk Hill St. and American Legion Hwy,02131
2016-08-17T06:55:00-04:00,Man stabbed to death in East Boston,Murder,214 Paris St.,02128
2016-08-17T05:56:00-04:00,"You snooze, you lose: Dorchester man arrested after police find him sleeping in a schoolyard with a loaded gun",Illegal gun possession,40 School St,02108
2016-08-16T22:00:00-04:00,"Police: Woman bites, kicks, punches commuter-rail conductor, then threatens to stab him",Assault and battery with a dangerous weapon,Milton St. and Hyde Park Ave.,02136
2016-08-16T18:00:00-04:00,Person shot in Dorchester,Shooting,60 Stockton St.,02124
2016-08-15T23:45:00-04:00,"Person shot, seriously wounded on Gavin Way in South Boston",Shooting,24 Gavin Way,02127
2016-08-15T20:30:00-04:00,"Arlington man charged as one-man crime wave in Charlestown, Somerville",Carjacking,437 Rutherford Ave.,02129
2016-08-15T00:30:00-04:00,T bus driver punched in the face in Allston,Assault and battery,Brighton Ave. and Cambridge St.,02134
2016-08-14T22:45:00-04:00,Night did not end well for man police say showed up at a party wearing a bullet-proof vest and carrying a loaded gun,Improper gun use,134 Whitfield St.,02124
2016-08-14T17:53:00-04:00,Police: Teen with realistic-looking BB gun arrested at Dominican festival on City Hall Plaza,Replica firearm,1 City Hall Sq.,02108
2016-08-13T22:30:00-04:00,"Two charged with threatening woman with guns, one of them pink",Illegal gun possession,7 Topliff St.,02122
2016-08-13T11:59:00-04:00,Shots fired in Roxbury,Gunfire,5 Raynor Circle,02120
2016-08-12T23:38:00-04:00,Man shot to death in Dorchester,Murder,21 Algonquin St.,02124
2016-08-11T23:39:00-04:00,Police locate guy who may have had young son in his SUV while he shot a man,Shooting,198 Blue Hill Ave.,02125
2016-08-11T02:55:00-04:00,Person stabbed repeatedly in Dorchester,Stabbing,28 Millet St.,02124
2016-08-10T23:30:00-04:00,Man stabbed outside Dorchester convenience store,Stabbing,156 Washington St.,02135
2016-08-08T23:21:00-04:00,Codman Square building shot at several times,Gunfire,22 Southern Ave.,02124
2016-08-07T01:00:00-04:00,Police rack up four arrests and three loaded guns in two Mission Hill foot chases,Illegal gun possession,64 McGreevey Way,02120
2016-08-07T00:15:00-04:00,Shots fired on Harrison Avenue in the South End,Gunfire,700 Harrison Ave.,02118
2016-08-06T22:50:00-04:00,Man stabbed in the side downtown,Stabbing,Summer St. and High St.,02110
2016-08-05T23:55:00-04:00,Man stabbed in the Back Bay,Stabbing,Commonwealth Ave. and Clarendon St.,02116
2016-08-04T17:15:00-04:00,Police say guy with a thing for bricks smashes man in the head with a brick for looking at him funny in North Station,Assault and battery with a dangerous weapon,100 Legends Way,02114
2016-08-04T15:00:00-04:00,Police tend to get suspicious when they see somebody jump out of a moving car - especially one they&#039;re trying to pull over,Illegal gun possession,12 Powellton Rd.,02121
2016-08-03T22:40:00-04:00,Woman sexually assaulted at gunpoint in Jamaica Plain,Sexual attack,189 Forest Hills St.,02130
2016-08-03T08:00:00-04:00,Police: Snarling Red Line rider arrested for knocking woman&#039;s phone out of her hands,Assault and battery,Dorchester Ave. and Southampton St.,02127
2016-07-30T22:30:00-04:00,Man shot in Fields Corner,Shooting,Park St. and Geneva Ave.,02124
2016-07-30T22:30:00-04:00,More gunfire in Roxbury,Gunfire,Humboldt Ave. and Martin Luther King Blvd.,02119
2016-07-30T18:20:00-04:00,Shots fired on Dale Street in Roxbury,Gunfire,25 Dale St.,02119
2016-07-30T17:15:00-04:00,Person shot in Dudley Square drive-by,Shooting,St. James Street,02119
2016-07-30T11:30:00-04:00,Armed home invasion in West Roxbury,Armed home invasion,15 Tobin Rd.,02132
2016-07-30T00:35:00-04:00,Police: Young Hyde Park teen was walking around Roxbury with a loaded gun early this morning,Illegal gun possession,144 Ruthven St.,02121
2016-07-29T04:30:00-04:00,Man shot in Dorchester,Shooting,Trull St. and Ware St.,02125
2016-07-28T21:50:00-04:00,"Police: Cop draws gun on man charging him with a knife, doesn&#039;t shoot him",Assault with a dangerous weapon,100 Legends Way,02114
2016-07-28T21:15:00-04:00,Person shot at Blue Hill Avenue and Columbia Road,Shooting,Blue Hill Ave. and Columbia Rd.,02121
2016-07-28T12:00:00-04:00,Resident drops a dime: 16 arrested for alleged brothel at Brighton house,Prostitution,108 Brooks St.,02135
2016-07-27T05:00:00-04:00,Man stabbed in the chest in Allston,Stabbing,1290 Commonwealth Ave.,02134
2016-07-26T23:55:00-04:00,Three shot in Mattapan,Shooting,115 Babson St.,02126
2016-07-26T22:58:00-04:00,Man stabbed in the leg in Fields Corner,Stabbing,274 Adams St.,02122
2016-07-26T21:37:00-04:00,Man sought for threatening someone with a weapon on an Orange Line train,Assault with a dangerous weapon,750 Washington St.,02111
2016-07-25T23:18:00-04:00,Two shot in Dorchester,Shooting,20 Stonehurst St.,02122
2016-07-24T21:30:00-04:00,Shots fired on Hancock Street in Dorchester; car hit,Gunfire,101 Hancock St.,02125
2016-07-24T00:30:00-04:00,"Mob rushes, robs Roslindale gas station",Robbery,Washington St. and South St.,02131
2016-07-23T01:10:00-04:00,Shots fired in Dorchester,Gunfire,41 Payson Ave.,02125
2016-07-22T23:30:00-04:00,Shots fired in Mattapan,Gunfire,26 Evelyn St.,02126
2016-07-22T21:55:00-04:00,Man shot in Dorchester,Shooting,156 Fuller St.,02124
2016-07-22T21:40:00-04:00,Person shot at strip mall on River Street in Mattapan,Shooting,90 River St.,02126
2016-07-21T22:40:00-04:00,Person shot in Dorchester,Shooting,Thetford Ave. and Evans St.,02124
2016-07-21T21:05:00-04:00,Man tased in Dorchester robbery; three arrested,Assault and battery with a dangerous weapon,42 Robinson St.,02122
2016-07-17T22:45:00-04:00,"Man jumped, stabbed in Roxbury",Stabbing,Nazing St. and Maple St.,02121
2016-07-16T18:15:00-04:00,"Man charged with hit and run, possession of LSD-laced Rice Krispy treats on Atlantic Avenue",Illegal drug possession,70 Rowes Wharf,02110
2016-07-16T15:45:00-04:00,Man stabbed on the Common,Stabbing,Tremont St. and Park St.,02108
2016-07-13T21:30:00-04:00,"Police: Guy crashes car in South Boston, tries to ditch loaded gun before first responders arrive",Illegal gun possession,E Street and W. 2 St.,02127
2016-07-12T17:30:00-04:00,Police: Man who ran at officers with a loaded gun after they heard him firing it is arrested in South Boston,Illegal gun possession,Gavin Way and Logan Way,02127
2016-07-11T23:00:00-04:00,Person shot on Monadnock Street in Dorchester,Shooting,Monadnock St.,02125
2016-07-11T23:00:00-04:00,Person shot on Gavin Way in South Boston,Shooting,19 Gavin Way,02127
2016-07-11T05:30:00-04:00,Woman shot in Mattapan; 14-year-old charged,Shooting,563 Norfolk St.,02126
2016-07-10T01:00:00-04:00,Woman reports attack by three men in East Boston park,Sexual attack,Bremen Street and Brook St.,02128
2016-07-09T19:45:00-04:00,Don&#039;t you hate it when you stand up and your gun falls out of your shorts?,Illegal gun possession,Harold St. and Ruthven St.,02121
2016-07-09T00:05:00-04:00,Person shot on Hansborough Street,Shooting,Hansborough St.,02124
2016-07-07T23:36:00-04:00,"Two shot, one dead in Dorchester",Murder,68 Hancock St.,02125
2016-07-05T09:30:00-04:00,South Boston bank robbed,Bank robbery,708 E. Broadway,02127
2016-07-04T15:40:00-04:00,Shots fired in Roxbury,Gunfire,Estabrook Rd. and Shawmut Ave.,02119
2016-07-04T01:24:00-04:00,Woman shot in the South End,Shooting,647 Harrison Ave.,02118
2016-07-03T20:05:00-04:00,Several cars shot up in Dorchester,Gunfire,Hildreth St. and Wildwood St.,02124
2016-07-02T22:15:00-04:00,Man shot in Dorchester,Shooting,Clifton St. and E. Cottage St.,02125
2016-06-30T18:45:00-04:00,Two arrested for gun and drug possession in Dorchester playground; third arrested on warrants,Illegal gun possession,56 Dunbar Ave.,02124
2016-06-29T19:45:00-04:00,Police: Lynn teen on a stolen bike used loaded gun to threaten people in Uphams Corner,Illegal gun possession,590 Dudley St.,02125
2016-06-29T15:00:00-04:00,Man hunted for Dorchester bank robbery,Bank robbery,585 Columbia Rd.,02125
2016-06-28T15:24:00-04:00,Gunfire leads to arrests in Dorchester - after suspects&#039; SUV crashes,Gunfire,Hancock St. and Upham Ave.,02125
2016-06-27T01:00:00-04:00,State Police: Man drives into state worker at Ted Williams work zone while drunk,OUI,Northern Ave. and Channel St.,02210
2016-06-26T03:00:00-04:00,Police: North End man dons bulletproof vest before threatening people with two butcher knives,Assault with a dangerous weapon,17 Cooper St.,02113
2016-06-25T23:20:00-04:00,Two stabbed in Roxbury,Stabbing,69 Burrell St.,02119
2016-06-24T15:25:00-04:00,Man shot to death in Mattapan,Murder,17 Doone Ave.,02126
2016-06-23T23:30:00-04:00,Person stabbed in South Boston,Stabbing,Joseph Agri St.,02127
2016-06-23T05:15:00-04:00,"Man found stabbed in the Fenway, taken away in bad shape",Stabbing,Queensberry St. and Park Drive,02215
2016-06-22T23:00:00-04:00,"While searching for dirt bikers who may have smashed cop&#039;s car window, officers find armed-robbery victim",Armed robbery,Dudley St. and W. Cottage St.,02125
2016-06-21T21:30:00-04:00,Woman shot in Dorchester,Shooting,586 Park St.,02124
2016-06-21T17:00:00-04:00,Firefighters rescue person in Charles River near Mass. Ave. bridge,Manslaughter,Back St. and Fairfield St.,02116
2016-06-21T14:45:00-04:00,Randolph man arrested for illegal gun possession in Dorchester,Illegal gun possession,31 Baird St.,02124
2016-06-20T23:30:00-04:00,"Two shot on Huntington Avenue, Mission Hill",Shooting,Huntington Ave. and Mission St.,02115
2016-06-20T23:25:00-04:00,Man shot in South Boston,Shooting,142 Msgr O&#039;Callaghan Way,02127
2016-06-20T10:05:00-04:00,Visually impaired woman sexually attacked next to the State House,Indecent assault and battery,Beacon St. and Bowdoin St.,02108
2016-06-19T22:30:00-04:00,Man stabbed in the back in East Boston,Stabbing,28 Meridian St.,02128
2016-06-19T00:30:00-04:00,Person shot in Dorchester,Shooting,Ellington St. and Greenwood St.,02121
2016-06-18T23:10:00-04:00,Man fatally shot in the head in Mattapan,Murder,62 Astoria St.,02126
2016-06-15T23:30:00-04:00,Roslindale Burger King held up at gunpoint,Armed robbery,4590 Washington St.,02131
2016-06-15T08:51:00-04:00,Woman found dead in East Boston garage,Murder,54 Princeton St.,02128
2016-06-14T17:00:00-04:00,Person shot in Dorchester,Shooting,1742 Dorchester Ave.,02124
2016-06-14T12:20:00-04:00,Man fatally shot in the head across street from Blue Hill Avenue police station,Murder,1186 Blue Hill Ave.,02126
2016-06-11T19:20:00-04:00,Police looking for guy they say ended an argument at South Station by stabbing his opponent,Stabbing,Atlantic Ave. and Summer St.,02210
2016-06-10T22:40:00-04:00,Person stabbed in East Boston,Stabbing,72 Trenton St.,02128
2016-06-09T08:50:00-04:00,"Brighton High School student arrested at school with a loaded, stolen gun, police say",Illegal gun possession,25 Warren St.,02135
2016-06-08T13:30:00-04:00,"Four shot outside Burke High School, one dead",Murder,46 Washington St.,02121
2016-06-04T23:20:00-04:00,Man shot to death on York Street in Dorchester,Murder,8 York St.,02121
2016-06-03T23:30:00-04:00,Woman shot in Franklin Hill home,Shooting,34 Franklin Hill Ave.,02124
2016-06-03T14:00:00-04:00,"Man tries, fails to hold up West Roxbury bank",Bank robbery,673 VFW Parkway,
2016-06-02T00:40:00-04:00,Two shot in East Boston,Shooting,250 Condor St.,02128
2016-06-01T06:15:00-04:00,Two women groped in Dorchester this morning,Indecent assault and battery,Columbia Rd. and Richfield St.,02125
2016-05-29T22:25:00-04:00,Man shot to death in Dorchester,Murder,131 Devon St.,02121
2016-05-28T23:20:00-04:00,Man shot in the leg in Mattapan,Shooting,Walk Hill St. and Fottler Rd.,02126
2016-05-27T20:45:00-04:00,Band manager charged with raping woman at House of Blues,Rape,15 Lansdowne St.,02215
2016-05-27T14:00:00-04:00,Man sought for Roslindale bank robbery,Bank robbery,29 Corinth St.,02131
2016-05-27T12:40:00-04:00,Woman slashed in Roxbury,Stabbing,338 Warren St.,02119
2016-05-27T09:40:00-04:00,Shots fired in Roxbury,Gunfire,Akron St. and Regent St.,02119
2016-05-26T20:00:00-04:00,Man shot in Mattapan Square,Shooting,Blue Hill Ave. and Rexford St.,02126
2016-05-26T16:00:00-04:00,Shots fired in Bromley-Heath,Gunfire,960 Parker St.,02130
2016-05-25T23:20:00-04:00,Woman shot in LoPresti Park in East Boston,Shooting,33 Sumner St.,02125
2016-05-25T00:10:00-04:00,Woman sexually attacked in Mattapan,Rape,Rosewood St. and Cummins Highway,02126
2016-05-24T13:00:00-04:00,"SpongeBob CrackPants: Two arrested on drug charges after Mattapan Square struggle, police say",Illegal drug possession,1641 Blue Hill Ave.,02126
2016-05-22T06:45:00-04:00,Two stabbed in Dorchester,Stabbing,Johnson Terrace,02124
2016-05-21T22:45:00-04:00,Person shot on Broad Street downtown,Shooting,101 Broad St.,02110
2016-05-21T11:38:00-04:00,"Police: When guy&#039;s friends picked him up in their car in the South End, they didn&#039;t realize he&#039;d just robbed a bank",Bank robbery,1320 Washington St.,02118
2016-05-20T07:00:00-04:00,"Police came for the gun and ammo, stayed for the dirt bikes",Illegal gun possession,7 Speedwell St.,02122
2016-05-19T21:15:00-04:00,"Another person shot in Codman Square, this time fatally",Murder,87 Southern Ave.,02124
2016-05-19T17:55:00-04:00,Police: Hyde Park teen nabbed with a gun near scene of recent double shooting in the South End,Illegal gun possession,W. Newton St. and San Juan St.,02118
2016-05-19T17:10:00-04:00,Two shot in Grove Hall,Shooting,469 Blue Hill Ave.,02121
2016-05-17T22:15:00-04:00,Two shot on Shawmut at West Newton in the South End,Shooting,Shawmut Ave. and W. Newton St.,02118
2016-05-16T14:40:00-04:00,Gunfire erupts at Centre and Highland in Roxbury,Gunfire,Centre St. and Highland Ave.,02119
2016-05-15T23:15:00-04:00,Woman shot in the arm near Codman Square,Shooting,3 Walton St.,02124
2016-05-15T14:40:00-04:00,"Man charged with punching out bus window in fit of road rage, showering driver with glass shards",Assault and battery,240 Western Ave.,02134
2016-05-14T23:55:00-04:00,Shots fired into Jamaica Plain building,Gunfire,12 Metcalf Ct.,02130
2016-05-14T22:50:00-04:00,Person shot in the leg at Humboldt and Seaver in Roxbury,Shooting,Humboldt Ave. and Seaver St.,02119
2016-05-14T21:57:00-04:00,"Person shot in the leg on Cabot Street, Roxbury",Shooting,185 Cabot St.,02120
2016-05-14T20:20:00-04:00,"Person shot in arm at Columbia and Quincy, Dorchester",Shooting,387 Columbia Rd.,02125
2016-05-13T18:40:00-04:00,Woman leaving church grazed by bullet in Codman Square,Shooting,651 Washington St.,02135
2016-05-12T22:20:00-04:00,Shots fired in Codman Square,Gunfire,310 Talbot Ave.,02124
2016-05-12T18:05:00-04:00,Roslindale market robbed at gunpoint,Armed robbery,229 Florence St.,02131
2016-05-12T07:15:00-04:00,Mother in critical condition after attack while walking daughter to school in Roxbury,Assault and battery with a dangerous weapon,Waumbeck St.,02121
2016-05-11T18:30:00-04:00,Dorchester foot chase involving man with gun ends with officers using pepper spray to disperse crowd,Illegal gun possession,14 Ronan St.,02125
2016-05-11T14:00:00-04:00,"Couple robs Newbury Street store together, then takes turns robbing the same Downtown Crossing bank",Bank robbery,24 Winter St.,02108
2016-05-10T21:20:00-04:00,Two charged with armed robbery of Codman Square market,Armed robbery,542 Washington St.,02111
2016-05-09T15:50:00-04:00,Man shot in the leg in Roxbury,Shooting,Georgia St. and Hartwell St.,02121
2016-05-08T16:55:00-04:00,"Person stabbed, seriously injured in Mattapan",Stabbing,551 Norfolk St.,02126
2016-05-07T02:00:00-04:00,Dorchester stabbing may have been revenge for rape several years earlier,Stabbing,70 Talbot Ave.,02124
2016-05-07T00:25:00-04:00,Gunfire at East Cottage and Leyland streets,Gunfire,E. Cottage St. and Leyland St.,02125
2016-05-06T23:55:00-04:00,Several shots fired into car off Morton Street in Dorchester,Gunfire,Wildwood St. and Middleton St.,02124
2016-05-06T22:53:00-04:00,"Man threatening to shoot someone in the South End arrested before he could, police say",Illegal gun possession,100 W. Dedham St.,02118
2016-05-05T17:00:00-04:00,Man sought for Roslindale bank robbery,Bank robbery,777 South St.,02131
2016-05-05T14:00:00-04:00,Back Bay bank held up,Bank robbery,61 Arlington St.,02116
2016-05-05T07:20:00-04:00,Woman stabbed in Blue Hill Avenue apartment building,Stabbing,484 Blue Hill Ave.,02121
2016-05-03T21:50:00-04:00,Two shot in Ashmont,Shooting,Bailey St. and Dorchester Ave.,02124
2016-05-02T15:00:00-04:00,Guys in hoodies rob Copley Square bank,Bank robbery,533 Boylston St.,02115
2016-05-01T22:55:00-04:00,Three masked men with guns burst into apartment just up street from C-11 police station,Armed home invasion,10 Gibson St.,02122
2016-05-01T21:30:00-04:00,South Boston market held up at knifepoint,Armed robbery,473 W. Broadway,02127
2016-05-01T14:20:00-04:00,Person shot in Uphams Corner,Shooting,726 Dudley St.,02125
